{
  "generated_at": "2026-06-22T21:55:50Z",
  "marketplace": "SkillForge",
  "schema_version": "0.1",
  "skills": [
    {
      "aliases": [
        "clinical statistical expert",
        "clinical-statistical-expert",
        "clinical statistics expert",
        "disease imaging expert",
        "medical imaging study design",
        "disease chapter generator",
        "radiology report language extraction",
        "clinical endpoint reviewer"
      ],
      "authoritative_sources": [
        "NCBI Bookshelf medical imaging and clinical training chapters",
        "ACR Appropriateness Criteria and other professional society guidance",
        "Radiology Assistant and other clinician-facing radiology training resources",
        "Broad clinical or radiology review articles",
        "Narrow primary studies only when the claim is narrow and labeled as such"
      ],
      "catalog_path": "skills/clinical-statistical-expert",
      "categories": [
        "Healthcare",
        "Clinical Research",
        "Medical Imaging",
        "Statistical Review"
      ],
      "checksum": {
        "algorithm": "sha256-tree",
        "value": "12dd3527afcca1ab27df9a65f58504304ae1eb20357f3ffd4010ef0f00fc4481"
      },
      "citations": [
        "Disease-specific citations live in `references/diseases/<disease>.md` and the corresponding source manifest.",
        "The gliosis chapter includes NCBI Bookshelf/Springer, ACR, Radiology Assistant, and PMC review sources."
      ],
      "codex": {
        "global_install_command": "python -m skillforge install clinical-statistical-expert --scope global",
        "install_scopes": [
          "global",
          "project"
        ],
        "project_install_command": "python -m skillforge install clinical-statistical-expert --scope project --project ."
      },
      "description": "Use this skill when a user wants clinical research reasoning that connects disease-specific clinical and imaging knowledge with statistical design, cohort definitions, endpoints, covariates, adjudication, bias, uncertainty, and claims language. Use for disease chapter creation, known-diagnosis image characterization, differential or mimic-aware review, report-language extraction, and clinical-statistical study planning. Do not use for final clinical diagnosis, treatment, triage, or unsupported medical claims.",
      "homepage_path": "skills/clinical-statistical-expert/README.md",
      "id": "clinical-statistical-expert",
      "name": "clinical-statistical-expert",
      "owner": "medatasci",
      "permissions": [
        "read user-provided clinical research questions, public source URLs, local disease chapters, and local evidence manifests",
        "write local draft disease chapters, review artifacts, manifests, and HTML previews when the user asks for development work",
        "do not download source material, store image assets, process private clinical data, publish changes, or make external network calls without explicit approval"
      ],
      "risk_level": "medium",
      "short_description": "Connect disease-specific clinical and imaging knowledge with statistical study design, cohort labels, endpoints, adjudication, uncertainty, and claims language.",
      "source": {
        "path": "skills/clinical-statistical-expert",
        "type": "github-repo-path",
        "url": null
      },
      "tags": [
        "clinical-research",
        "cohort-definition",
        "differential-diagnosis",
        "disease-chapters",
        "endpoints",
        "evidence-review",
        "medical-imaging",
        "mri",
        "radiology",
        "report-language",
        "statistics"
      ],
      "tasks": [
        "characterize known-diagnosis disease appearance on diagnostic imaging",
        "explain what to look for on MRI for a disease or finding",
        "compare a disease with similar-appearing mimics",
        "map radiology report language to cohort labels and endpoint implications",
        "identify missing clinical or imaging information",
        "review misclassification, confounding, and adjudication risks",
        "create or update source-grounded disease chapters",
        "render disease chapter HTML previews for human review"
      ],
      "title": "Clinical Statistical Expert",
      "updated_at": "2026-05-07T23:22:16Z",
      "warnings": [
        "External URL reference found in README.md",
        "External URL reference found in references/diseases/cerebral-infarction.figures.json",
        "External URL reference found in references/diseases/cerebral-infarction.sources.json",
        "External URL reference found in references/diseases/gliosis.figures.json",
        "External URL reference found in references/diseases/gliosis.md",
        "External URL reference found in references/diseases/gliosis.source-review.md",
        "External URL reference found in references/diseases/gliosis.sources.json",
        "External URL reference found in references/templates/disease.figures.schema.json",
        "External URL reference found in references/templates/disease.sources.schema.json"
      ]
    },
    {
      "aliases": [
        "repo to skills",
        "repository to agentic skills",
        "codebase to skills",
        "codebase-to-agentic-skills",
        "source-context map",
        "candidate skill discovery",
        "skill generator"
      ],
      "authoritative_sources": [
        "SkillForge requirements: https://github.com/medatasci/agent_skills/blob/main/requirements.md",
        "Codebase-To-Agentic-Skills design: https://github.com/medatasci/agent_skills/blob/main/docs/codebase-to-agentic-skills.md",
        "Skill Design Card template: https://github.com/medatasci/agent_skills/blob/main/docs/templates/codebase-readiness-card.md"
      ],
      "catalog_path": "skills/codebase-to-agentic-skills",
      "categories": [
        "Developer Tools",
        "Agent Workflows",
        "Skill Generation"
      ],
      "checksum": {
        "algorithm": "sha256-tree",
        "value": "5ef48e4ee93f00d864868f5e1082b4efb649846d7c148c8b77793eae7e47fe9d"
      },
      "citations": [
        "Not applicable. This is a SkillForge workflow skill. Cite upstream source repositories, model cards, papers, licenses, and dataset cards in each generated Skill Design Card or skill package."
      ],
      "codex": {
        "global_install_command": "python -m skillforge install codebase-to-agentic-skills --scope global",
        "install_scopes": [
          "global",
          "project"
        ],
        "project_install_command": "python -m skillforge install codebase-to-agentic-skills --scope project --project ."
      },
      "description": "Use this skill when a user wants to turn a GitHub repository, local codebase, algorithm package, model repo, MONAI workflow, or other source project into one or more reviewable SkillForge agentic skills. Use for source-context mapping, candidate skill discovery, repo-to-skills planning, Skill Design Cards, LLM versus deterministic responsibility splits, adapter planning, smoke-test planning, and publication evidence. Do not use to blindly wrap code without source evidence, license review, safety boundaries, or user approval for writes/network/runtime work.",
      "homepage_path": "skills/codebase-to-agentic-skills/README.md",
      "id": "codebase-to-agentic-skills",
      "name": "codebase-to-agentic-skills",
      "owner": "medatasci",
      "permissions": [
        "read local repository files",
        "optionally write Markdown and JSON draft artifacts when the user supplies an output directory",
        "no network access unless the user approves cloning or fetching source material",
        "no upstream code execution, dependency installation, model download, or credential use by default"
      ],
      "risk_level": "low",
      "short_description": "Turn a source repository or local codebase into a reviewable set of candidate SkillForge agentic skills using source-context maps, candidate tables, Skill Design Cards, adapter plans, and publication evidence.",
      "source": {
        "path": "skills/codebase-to-agentic-skills",
        "type": "github-repo-path",
        "url": null
      },
      "tags": [
        "adapter-planning",
        "agentic-skills",
        "codebase",
        "readiness-card",
        "repository-analysis",
        "skill-design-card",
        "skillforge",
        "source-context"
      ],
      "tasks": [
        "turn a repository into candidate agentic skills",
        "build a source-context map",
        "create a candidate skill table",
        "draft Skill Design Cards",
        "split LLM and deterministic Python responsibilities",
        "plan adapter commands and smoke tests",
        "prepare repo-derived SkillForge skills for publication"
      ],
      "title": "Codebase To Agentic Skills",
      "updated_at": "2026-05-06T11:38:11Z",
      "warnings": [
        "External URL reference found in README.md",
        "External URL reference found in SKILL.md"
      ]
    },
    {
      "aliases": [
        "youtube transcripts",
        "youtube captions",
        "youtube research",
        "video transcript extraction",
        "yt-dlp workflow"
      ],
      "catalog_path": "skills/get-youtube-media",
      "categories": [
        "Research",
        "Media"
      ],
      "checksum": {
        "algorithm": "sha256-tree",
        "value": "a519df43c1e71e12c232d896a3a11cc123d5176ab27ba1d672d303fbee9bbca5"
      },
      "codex": {
        "global_install_command": "python -m skillforge install get-youtube-media --scope global",
        "install_scopes": [
          "global",
          "project"
        ],
        "project_install_command": "python -m skillforge install get-youtube-media --scope project --project ."
      },